Key,Item Type,Publication Year,Author,Title,Publication Title,ISBN,ISSN,DOI,Url,Abstract Note,Date,Date Added,Date Modified,Access Date,Pages,Num Pages,Issue,Volume,Number Of Volumes,Journal Abbreviation,Short Title,Series,Series Number,Series Text,Series Title,Publisher,Place,Language,Rights,Type,Archive,Archive Location,Library Catalog,Call Number,Extra,Notes,File Attachments,Link Attachments,Manual Tags,Automatic Tags,Editor,Series Editor,Translator,Contributor,Attorney Agent,Book Author,Cast Member,Commenter,Composer,Cosponsor,Counsel,Interviewer,Producer,Recipient,Reviewed Author,Scriptwriter,Words By,Guest,Number,Edition,Running Time,Scale,Medium,Artwork Size,Filing Date,Application Number,Assignee,Issuing Authority,Country,Meeting Name,Conference Name,Court,References,Reporter,Legal Status,Priority Numbers,Programming Language,Version,System,Code,Code Number,Section,Session,Committee,History,Legislative Body
3Q25U6PR,journalArticle,2016,"Schneider, Richard R.; Devito, Kevin; Kettridge, Nicholas; Bayne, Erin",Moving beyond bioclimatic envelope models: integrating upland forest and peatland processes to predict ecosystem transitions under climate change in the western Canadian boreal plain: Western boreal ecosystem transitions under climate change,Ecohydrology,,19360584,10.1002/eco.1707,http://doi.wiley.com/10.1002/eco.1707,,2016-09,8/14/2020 17:21,8/14/2020 17:21,8/14/2020 17:21,899-908,,6,9,,Ecohydrol.,Moving beyond bioclimatic envelope models,,,,,,,en,,,,,DOI.org (Crossref),,,1,C:\Users\trase\Zotero\storage\PKKMWGEJ\Schneider et al. - 2016 - Moving beyond bioclimatic envelope models integra.pdf,,,,,,,,,,,,,,,,,,,,,,,,,,,,,,,,,,,,,,,,,,,,,,,,,
R8CWSVG8,journalArticle,2018,"Axelsson, Erik Petter; Senior, John Keith",The extended consequences of genetic conductivity: Mating distance affects community phenotypes in Norway spruce,Ecology and Evolution,,20457758,10.1002/ece3.4616,http://doi.wiley.com/10.1002/ece3.4616,,2018-12,8/14/2020 17:20,8/14/2020 17:20,8/14/2020 17:20,11645-11655,,23,8,,Ecol Evol,The extended consequences of genetic conductivity,,,,,,,en,,,,,DOI.org (Crossref),,,,C:\Users\trase\Zotero\storage\2CQ59SMC\Axelsson and Senior - 2018 - The extended consequences of genetic conductivity.pdf,,,,,,,,,,,,,,,,,,,,,,,,,,,,,,,,,,,,,,,,,,,,,,,,,
4V8FPZ4W,journalArticle,2017,"Whittet, Richard; Cavers, Stephen; Cottrell, Joan; Rosique-Esplugas, Cristina; Ennos, Richard",Substantial variation in the timing of pollen production reduces reproductive synchrony between distant populations of <i>Pinus sylvestris</i> L. in Scotland,Ecology and Evolution,,20457758,10.1002/ece3.3154,http://doi.wiley.com/10.1002/ece3.3154,,2017-08,8/14/2020 17:20,8/14/2020 17:20,8/14/2020 17:20,5754-5765,,15,7,,Ecol Evol,,,,,,,,en,,,,,DOI.org (Crossref),,,,C:\Users\trase\Zotero\storage\L2VLNY9Q\Whittet et al. - 2017 - Substantial variation in the timing of pollen prod.pdf,,,,,,,,,,,,,,,,,,,,,,,,,,,,,,,,,,,,,,,,,,,,,,,,,
E3FV9FTW,journalArticle,2020,"Gómez‐Pineda, Erika; Sáenz‐Romero, Cuauhtémoc; Ortega‐Rodríguez, Juan Manuel; Blanco‐García, Arnulfo; Madrigal‐Sánchez, Xavier; Lindig‐Cisneros, Roberto; Lopez‐Toledo, Leonel; Pedraza‐Santos, Martha Elena; Rehfeldt, Gerald E.",Suitable climatic habitat changes for Mexican conifers along altitudinal gradients under climatic change scenarios,Ecological Applications,,"1051-0761, 1939-5582",10.1002/eap.2041,https://onlinelibrary.wiley.com/doi/abs/10.1002/eap.2041,,2020-03,8/14/2020 17:20,8/18/2020 3:38,8/14/2020 17:20,,,2,30,,Ecol Appl,,,,,,,,en,,,,,DOI.org (Crossref),,,,,,,,,,,,,,,,,,,,,,,,,,,,,,,,,,,,,,,,,,,,,,,,,,,,,
ILEHHG2Z,journalArticle,2019,"Yazzie, Jaime O.; Fulé, Peter Z.; Kim, Yeon‐Su; Sánchez Meador, Andrew",Diné kinship as a framework for conserving native tree species in climate change,Ecological Applications,,"1051-0761, 1939-5582",10.1002/eap.1944,https://onlinelibrary.wiley.com/doi/abs/10.1002/eap.1944,,2019-09,8/14/2020 17:20,8/14/2020 17:20,8/14/2020 17:20,,,6,29,,Ecol Appl,,,,,,,,en,,,,,DOI.org (Crossref),,,1,,,,,,,,,,,,,,,,,,,,,,,,,,,,,,,,,,,,,,,,,,,,,,,,,,
6TLHK89A,journalArticle,2017,"Boiffin, Juliette; Badeau, Vincent; Bréda, Nathalie",Species distribution models may misdirect assisted migration: insights from the introduction of Douglas-fir to Europe,Ecological Applications,,10510761,10.1002/eap.1448,http://doi.wiley.com/10.1002/eap.1448,,2017-03,8/14/2020 17:20,8/14/2020 17:20,8/14/2020 17:20,446-457,,2,27,,Ecol Appl,Species distribution models may misdirect assisted migration,,,,,,,en,,,,,DOI.org (Crossref),,,,C:\Users\trase\Zotero\storage\IUSWB5HL\Boiffin et al. - 2017 - Species distribution models may misdirect assisted.pdf,,,,,,,,,,,,,,,,,,,,,,,,,,,,,,,,,,,,,,,,,,,,,,,,,
SRHEUQQP,journalArticle,2018,"Wershow, Samuel T.; DeChaine, Eric G.",Retreat to refugia: Severe habitat contraction projected for endemic alpine plants of the Olympic Peninsula,American Journal of Botany,,29122,10.1002/ajb2.1042,http://doi.wiley.com/10.1002/ajb2.1042,,2018-04,8/14/2020 17:19,8/14/2020 17:19,8/14/2020 17:19,760-778,,4,105,,Am J Bot,Retreat to refugia,,,,,,,en,,,,,DOI.org (Crossref),,,1,C:\Users\trase\Zotero\storage\8AVXF9LM\Wershow and DeChaine - 2018 - Retreat to refugia Severe habitat contraction pro.pdf,,,,,,,,,,,,,,,,,,,,,,,,,,,,,,,,,,,,,,,,,,,,,,,,,
7LQ7G4F2,journalArticle,2016,"Ramírez-Amezcua, Yocupitzia; Steinmann, Victor W.; Ruiz-Sanchez, Eduardo; Rojas-Soto, Octavio R.",Mexican alpine plants in the face of global warming: potential extinction within a specialized assemblage of narrow endemics,Biodiversity and Conservation,,"0960-3115, 1572-9710",10.1007/s10531-016-1094-x,http://link.springer.com/10.1007/s10531-016-1094-x,,2016-05,8/14/2020 17:23,8/14/2020 17:23,8/14/2020 17:23,865-885,,5,25,,Biodivers Conserv,Mexican alpine plants in the face of global warming,,,,,,,en,,,,,DOI.org (Crossref),,,1,,,,,,,,,,,,,,,,,,,,,,,,,,,,,,,,,,,,,,,,,,,,,,,,,,
T6JYCV2J,journalArticle,2019,"Frischbier, Nico; Nikolova, Petia Simeonova; Brang, Peter; Klumpp, Raphael; Aas, Gregor; Binder, Franz",Climate change adaptation with non-native tree species in Central European forests: early tree survival in a multi-site field trial,European Journal of Forest Research,,"1612-4669, 1612-4677",10.1007/s10342-019-01222-1,http://link.springer.com/10.1007/s10342-019-01222-1,,2019-12,8/14/2020 17:23,8/18/2020 3:38,8/14/2020 17:23,1015-1032,,6,138,,Eur J Forest Res,Climate change adaptation with non-native tree species in Central European forests,,,,,,,en,,,,,DOI.org (Crossref),,,1,,,,,,,,,,,,,,,,,,,,,,,,,,,,,,,,,,,,,,,,,,,,,,,,,,
5BNZ3L3Z,journalArticle,2018,"Benito-Garzón, Marta; Fady, Bruno; Davi, Hendrik; Vizcaíno-Palomar, Natalia; Fernández-Manjarrés, Juan",Trees on the move: using decision theory to compensate for climate change at the regional scale in forest social-ecological systems,Regional Environmental Change,,"1436-3798, 1436-378X",10.1007/s10113-018-1277-y,http://link.springer.com/10.1007/s10113-018-1277-y,,2018-06,8/14/2020 17:22,8/14/2020 17:22,8/14/2020 17:22,1427-1437,,5,18,,Reg Environ Change,Trees on the move,,,,,,,en,,,,,DOI.org (Crossref),,,,,,,,,,,,,,,,,,,,,,,,,,,,,,,,,,,,,,,,,,,,,,,,,,,,,
UIUQ97FD,journalArticle,2016,"Barber, Quinn E.; Nielsen, Scott E.; Hamann, Andreas","Assessing the vulnerability of rare plants using climate change velocity, habitat connectivity, and dispersal ability: a case study in Alberta, Canada",Regional Environmental Change,,"1436-3798, 1436-378X",10.1007/s10113-015-0870-6,http://link.springer.com/10.1007/s10113-015-0870-6,,2016-06,8/14/2020 17:22,8/14/2020 17:22,8/14/2020 17:22,1433-1441,,5,16,,Reg Environ Change,"Assessing the vulnerability of rare plants using climate change velocity, habitat connectivity, and dispersal ability",,,,,,,en,,,,,DOI.org (Crossref),,,1,,,,,,,,,,,,,,,,,,,,,,,,,,,,,,,,,,,,,,,,,,,,,,,,,,
2KIQEC8E,journalArticle,2018,"Argüelles-Moyao, Andrés; Garibay-Orijel, Roberto",Ectomycorrhizal fungal communities in high mountain conifer forests in central Mexico and their potential use in the assisted migration of Abies religiosa,Mycorrhiza,,"0940-6360, 1432-1890",10.1007/s00572-018-0841-0,http://link.springer.com/10.1007/s00572-018-0841-0,,2018-08,8/14/2020 17:22,8/14/2020 17:22,8/14/2020 17:22,509-521,,6-May,28,,Mycorrhiza,,,,,,,,en,,,,,DOI.org (Crossref),,,1,,,,,,,,,,,,,,,,,,,,,,,,,,,,,,,,,,,,,,,,,,,,,,,,,,
7CNHBPZR,journalArticle,2020,"Pietruszka, Mariusz A.",Chemical Potential-Induced Wall State Transitions in Plant Cell Growth,Journal of Plant Growth Regulation,,"0721-7595, 1435-8107",10.1007/s00344-019-10026-x,http://link.springer.com/10.1007/s00344-019-10026-x,,2020-06,8/14/2020 17:22,8/14/2020 17:22,8/14/2020 17:22,841-866,,2,39,,J Plant Growth Regul,,,,,,,,en,,,,,DOI.org (Crossref),,,1,C:\Users\trase\Zotero\storage\3JUNCI4N\Pietruszka - 2020 - Chemical Potential-Induced Wall State Transitions .pdf,,,,,,,,,,,,,,,,,,,,,,,,,,,,,,,,,,,,,,,,,,,,,,,,,
P6M7PM9V,journalArticle,2013,"Rohr, Jason R.; Johnson, Philip; Hickey, Christopher W.; Helm, Roger C.; Fritz, Alyce; Brasfield, Sandra","Implications of global climate change for natural resource damage assessment, restoration, and rehabilitation",Environmental Toxicology and Chemistry,,7307268,10.1002/etc.2036,http://doi.wiley.com/10.1002/etc.2036,,2013-01,8/14/2020 17:21,8/14/2020 17:21,8/14/2020 17:21,93-101,,1,32,,Environmental Toxicology and Chemistry,,,,,,,,en,,,,,DOI.org (Crossref),,,1,C:\Users\trase\Zotero\storage\K6SEXVIS\Rohr et al. - 2013 - Implications of global climate change for natural .pdf,,,,,,,,,,,,,,,,,,,,,,,,,,,,,,,,,,,,,,,,,,,,,,,,,
JL7HMAA6,journalArticle,2016,"Fahey, Robert T.",Variation in responsiveness of woody plant leaf out phenology to anomalous spring onset,Ecosphere,,21508925,10.1002/ecs2.1209,http://doi.wiley.com/10.1002/ecs2.1209,,2016-02,8/14/2020 17:21,8/14/2020 17:21,8/14/2020 17:21,,,2,7,,Ecosphere,,,,,,,,en,,,,,DOI.org (Crossref),,,,C:\Users\trase\Zotero\storage\SGNADYGN\Fahey - 2016 - Variation in responsiveness of woody plant leaf ou.pdf,,,,"Peters, D. P. C.",,,,,,,,,,,,,,,,,,,,,,,,,,,,,,,,,,,,,,,,,,,,,
98WJ29D5,journalArticle,2019,"Barnes, Jessica Cavin; Delborne, Jason A.",Rethinking restoration targets for American chestnut using species distribution modeling,Biodiversity and Conservation,,"0960-3115, 1572-9710",10.1007/s10531-019-01814-8,http://link.springer.com/10.1007/s10531-019-01814-8,,2019-10,8/14/2020 17:23,8/14/2020 17:23,8/14/2020 17:23,3199-3220,,12,28,,Biodivers Conserv,,,,,,,,en,,,,,DOI.org (Crossref),,,1,,,,,,,,,,,,,,,,,,,,,,,,,,,,,,,,,,,,,,,,,,,,,,,,,,
K4B6VNXT,journalArticle,2018,"Peterson St-Laurent, Guillaume; Hagerman, Shannon; Kozak, Robert",What risks matter? Public views about assisted migration and other climate-adaptive reforestation strategies,Climatic Change,,"0165-0009, 1573-1480",10.1007/s10584-018-2310-3,http://link.springer.com/10.1007/s10584-018-2310-3,,2018-12,8/14/2020 17:23,8/14/2020 17:23,8/14/2020 17:23,573-587,,4-Mar,151,,Climatic Change,What risks matter?,,,,,,,en,,,,,DOI.org (Crossref),,,,C:\Users\trase\Zotero\storage\PQGZ5AKK\Peterson St-Laurent et al. - 2018 - What risks matter Public views about assisted mig.pdf,,,,,,,,,,,,,,,,,,,,,,,,,,,,,,,,,,,,,,,,,,,,,,,,,
BSHQ3WST,journalArticle,2018,"Park, Andrew; Talbot, Carolyn; Smith, Ryan",Trees for tomorrow: an evaluation framework to assess potential candidates for assisted migration to Manitoba’s forests,Climatic Change,,"0165-0009, 1573-1480",10.1007/s10584-018-2201-7,http://link.springer.com/10.1007/s10584-018-2201-7,,2018-06,8/14/2020 17:23,8/14/2020 17:23,8/14/2020 17:23,591-606,,4,148,,Climatic Change,Trees for tomorrow,,,,,,,en,,,,,DOI.org (Crossref),,,,C:\Users\trase\Zotero\storage\FA5TNHYT\Park et al. - 2018 - Trees for tomorrow an evaluation framework to ass.pdf,,,,,,,,,,,,,,,,,,,,,,,,,,,,,,,,,,,,,,,,,,,,,,,,,
ILBJ6EAN,journalArticle,2012,"Moir, Melinda L.; Vesk, Peter A.; Brennan, Karl E. C.; Hughes, Lesley; Keith, David A.; McCarthy, Michael A.; Coates, David J.; Barrett, Sarah",A preliminary assessment of changes in plant-dwelling insects when threatened plants are translocated,Journal of Insect Conservation,,"1366-638X, 1572-9753",10.1007/s10841-011-9422-7,http://link.springer.com/10.1007/s10841-011-9422-7,,2012-06,8/14/2020 17:24,8/14/2020 17:24,8/14/2020 17:24,367-377,,3,16,,J Insect Conserv,,,,,,,,en,,,,,DOI.org (Crossref),,,1,,,,,,,,,,,,,,,,,,,,,,,,,,,,,,,,,,,,,,,,,,,,,,,,,,
H97BCJVY,journalArticle,2012,"Pautasso, Marco; Döring, Thomas F.; Garbelotto, Matteo; Pellis, Lorenzo; Jeger, Mike J.",Impacts of climate change on plant diseases—opinions and trends,European Journal of Plant Pathology,,"0929-1873, 1573-8469",10.1007/s10658-012-9936-1,http://link.springer.com/10.1007/s10658-012-9936-1,,2012-05,8/14/2020 17:24,8/14/2020 17:24,8/14/2020 17:24,295-313,,1,133,,Eur J Plant Pathol,,,,,,,,en,,,,,DOI.org (Crossref),,,,C:\Users\trase\Zotero\storage\57HWGLUN\Pautasso et al. - 2012 - Impacts of climate change on plant diseases—opinio.pdf,,,,,,,,,,,,,,,,,,,,,,,,,,,,,,,,,,,,,,,,,,,,,,,,,
R9WXXAUG,journalArticle,2016,"Prasad, Anantha M.; Iverson, Louis R.; Matthews, Stephen N.; Peters, Matthew P.","A multistage decision support framework to guide tree species management under climate change via habitat suitability and colonization models, and a knowledge-based scoring system",Landscape Ecology,,"0921-2973, 1572-9761",10.1007/s10980-016-0369-7,http://link.springer.com/10.1007/s10980-016-0369-7,,2016-11,8/14/2020 17:24,8/14/2020 17:24,8/14/2020 17:24,2187-2204,,9,31,,Landscape Ecol,,,,,,,,en,,,,,DOI.org (Crossref),,,,,,,,,,,,,,,,,,,,,,,,,,,,,,,,,,,,,,,,,,,,,,,,,,,,,
JD7V8UJT,journalArticle,2013,"Iverson, Louis R.; McKenzie, Donald","Tree-species range shifts in a changing climate: detecting, modeling, assisting",Landscape Ecology,,"0921-2973, 1572-9761",10.1007/s10980-013-9885-x,http://link.springer.com/10.1007/s10980-013-9885-x,,2013-05,8/14/2020 17:24,8/18/2020 3:38,8/14/2020 17:24,879-889,,5,28,,Landscape Ecol,Tree-species range shifts in a changing climate,,,,,,,en,,,,,DOI.org (Crossref),,,,,,,,,,,,,,,,,,,,,,,,,,,,,,,,,,,,,,,,,,,,,,,,,,,,,
94ECUUEB,journalArticle,2018,"Spathelf, Peter; Stanturf, John; Kleine, Michael; Jandl, Robert; Chiatante, Donato; Bolte, Andreas",Adaptive measures: integrating adaptive forest management and forest landscape restoration,Annals of Forest Science,,"1286-4560, 1297-966X",10.1007/s13595-018-0736-4,http://link.springer.com/10.1007/s13595-018-0736-4,,2018-06,8/14/2020 17:25,8/14/2020 17:25,8/14/2020 17:25,"55, s13595-018-0736-4",,2,75,,Annals of Forest Science,Adaptive measures,,,,,,,en,,,,,DOI.org (Crossref),,,1,C:\Users\trase\Zotero\storage\SA3LE3XX\Spathelf et al. - 2018 - Adaptive measures integrating adaptive forest man.pdf,,,,,,,,,,,,,,,,,,,,,,,,,,,,,,,,,,,,,,,,,,,,,,,,,
X8Z2K3EP,journalArticle,2014,"Smith, Paul L.",Lichen translocation with reference to species conservation and habitat restoration,Symbiosis,,"0334-5114, 1878-7665",10.1007/s13199-014-0269-z,http://link.springer.com/10.1007/s13199-014-0269-z,,2014-01,8/14/2020 17:25,8/14/2020 17:25,8/14/2020 17:25,17-28,,1,62,,Symbiosis,,,,,,,,en,,,,,DOI.org (Crossref),,,1,,,,,,,,,,,,,,,,,,,,,,,,,,,,,,,,,,,,,,,,,,,,,,,,,,
KHKWYBIU,journalArticle,2019,"Castaldi, Cristiano; Marchi, Maurizio; Vacchiano, Giorgio; Corona, Piermaria",Douglas-fir climate sensitivity at two contrasting sites along the southern limit of the European planting range,Journal of Forestry Research,,"1007-662X, 1993-0607",10.1007/s11676-019-01041-5,http://link.springer.com/10.1007/s11676-019-01041-5,,10/3/2019,8/14/2020 17:25,8/18/2020 3:38,8/14/2020 17:25,,,,,,J. For. Res.,,,,,,,,en,,,,,DOI.org (Crossref),,,1,C:\Users\trase\Zotero\storage\5UG8W6GH\Castaldi et al. - 2019 - Douglas-fir climate sensitivity at two contrasting.pdf,,,,,,,,,,,,,,,,,,,,,,,,,,,,,,,,,,,,,,,,,,,,,,,,,
5JXHRGGH,journalArticle,2016,"Reiter, Noushka; Whitfield, Julie; Pollard, Gail; Bedggood, Wendy; Argall, Mary; Dixon, Kingsley; Davis, Belinda; Swarts, Nigel",Orchid re-introductions: an evaluation of success and ecological considerations using key comparative studies from Australia,Plant Ecology,,"1385-0237, 1573-5052",10.1007/s11258-015-0561-x,http://link.springer.com/10.1007/s11258-015-0561-x,,2016-01,8/14/2020 17:24,8/14/2020 17:24,8/14/2020 17:24,81-95,,1,217,,Plant Ecol,Orchid re-introductions,,,,,,,en,,,,,DOI.org (Crossref),,,1,,,,,,,,,,,,,,,,,,,,,,,,,,,,,,,,,,,,,,,,,,,,,,,,,,
G8GKH2CC,journalArticle,2016,"Wendelberger, Kristie S.; Maschinski, Joyce",Assessing microsite and regeneration niche preferences through experimental reintroduction of the rare plant Tephrosia angustissima var. corallicola,Plant Ecology,,"1385-0237, 1573-5052",10.1007/s11258-015-0521-5,http://link.springer.com/10.1007/s11258-015-0521-5,,2016-02,8/14/2020 17:24,8/14/2020 17:24,8/14/2020 17:24,155-167,,2,217,,Plant Ecol,,,,,,,,en,,,,,DOI.org (Crossref),,,1,,,,,,,,,,,,,,,,,,,,,,,,,,,,,,,,,,,,,,,,,,,,,,,,,,
VMGC2AZN,journalArticle,2016,"Ren, Hai; Wang, Jun; Liu, Hong; Yuan, Lianlian; Xu, Yi; Zhang, Qianmei; Yu, Hui; Luo, Jian",Conservation introduction resulted in similar reproductive success of Camellia changii compared with augmentation,Plant Ecology,,"1385-0237, 1573-5052",10.1007/s11258-015-0515-3,http://link.springer.com/10.1007/s11258-015-0515-3,,2016-02,8/14/2020 17:24,8/14/2020 17:24,8/14/2020 17:24,219-228,,2,217,,Plant Ecol,,,,,,,,en,,,,,DOI.org (Crossref),,,1,,,,,,,,,,,,,,,,,,,,,,,,,,,,,,,,,,,,,,,,,,,,,,,,,,
DRBSWJXP,journalArticle,2019,"Boulanger, Yan; Arseneault, Dominique; Boucher, Yan; Gauthier, Sylvie; Cyr, Dominic; Taylor, Anthony R.; Price, David T.; Dupuis, Sébastien",Climate change will affect the ability of forest management to reduce gaps between current and presettlement forest composition in southeastern Canada,Landscape Ecology,,"0921-2973, 1572-9761",10.1007/s10980-018-0761-6,http://link.springer.com/10.1007/s10980-018-0761-6,,2019-01,8/14/2020 17:24,8/18/2020 3:38,8/14/2020 17:24,159-174,,1,34,,Landscape Ecol,,,,,,,,en,,,,,DOI.org (Crossref),,,1,,,,,,,,,,,,,,,,,,,,,,,,,,,,,,,,,,,,,,,,,,,,,,,,,,
RPQJH3IG,journalArticle,2010,"Ogawa-Onishi, Yuko; Berry, Pam M.; Tanaka, Nobuyuki",Assessing the potential impacts of climate change and their conservation implications in Japan: A case study of conifers,Biological Conservation,,63207,10.1016/j.biocon.2010.04.021,https://linkinghub.elsevier.com/retrieve/pii/S0006320710001655,,2010-07,8/14/2020 17:25,8/14/2020 17:25,8/14/2020 17:25,1728-1736,,7,143,,Biological Conservation,Assessing the potential impacts of climate change and their conservation implications in Japan,,,,,,,en,,,,,DOI.org (Crossref),,,1,,,,,,,,,,,,,,,,,,,,,,,,,,,,,,,,,,,,,,,,,,,,,,,,,,
YCIQB6BU,journalArticle,2012,"Van der Veken, Sebastiaan; De Frenne, Pieter; Baeten, Lander; Van Beek, Eric; Verheyen, Kris; Hermy, Martin",Experimental assessment of the survival and performance of forest herbs transplanted beyond their range limit,Basic and Applied Ecology,,14391791,10.1016/j.baae.2011.10.007,https://linkinghub.elsevier.com/retrieve/pii/S1439179111001393,,2012-02,8/14/2020 17:25,8/14/2020 17:25,8/14/2020 17:25,19-Oct,,1,13,,Basic and Applied Ecology,,,,,,,,en,,,,,DOI.org (Crossref),,,1,,,,,,,,,,,,,,,,,,,,,,,,,,,,,,,,,,,,,,,,,,,,,,,,,,
YZ98L6HP,journalArticle,2013,"Pautasso, Marco; Aas, Gregor; Queloz, Valentin; Holdenrieder, Ottmar",European ash (Fraxinus excelsior) dieback – A conservation biology challenge,Biological Conservation,,63207,10.1016/j.biocon.2012.08.026,https://linkinghub.elsevier.com/retrieve/pii/S0006320712003813,,2013-02,8/14/2020 17:25,8/14/2020 17:25,8/14/2020 17:25,37-49,,,158,,Biological Conservation,,,,,,,,en,,,,,DOI.org (Crossref),,,1,,,,,,,,,,,,,,,,,,,,,,,,,,,,,,,,,,,,,,,,,,,,,,,,,,
JKVFZLWD,journalArticle,2013,"Mekasha, Aklilu; Nigatu, Lisanework; Tesfaye, Kindie; Duncan, Alan J.",Modeling the response of tropical highland herbaceous grassland species to climate change: The case of the Arsi Mountains of Ethiopia,Biological Conservation,,63207,10.1016/j.biocon.2013.09.020,https://linkinghub.elsevier.com/retrieve/pii/S0006320713003376,,2013-12,8/14/2020 17:25,8/14/2020 17:25,8/14/2020 17:25,169-175,,,168,,Biological Conservation,Modeling the response of tropical highland herbaceous grassland species to climate change,,,,,,,en,,,,,DOI.org (Crossref),,,1,C:\Users\trase\Zotero\storage\BU2NQDK3\Mekasha et al. - 2013 - Modeling the response of tropical highland herbace.pdf,,,,,,,,,,,,,,,,,,,,,,,,,,,,,,,,,,,,,,,,,,,,,,,,,
L9F758IN,journalArticle,2010,"Woodall, C.W.; Nowak, D.J.; Liknes, G.C.; Westfall, J.A.",Assessing the potential for urban trees to facilitate forest tree migration in the eastern United States,Forest Ecology and Management,,3781127,10.1016/j.foreco.2010.01.018,https://linkinghub.elsevier.com/retrieve/pii/S0378112710000241,,2010-03,8/14/2020 17:26,8/14/2020 17:26,8/14/2020 17:26,1447-1454,,8,259,,Forest Ecology and Management,,,,,,,,en,,,,,DOI.org (Crossref),,,1,,,,,,,,,,,,,,,,,,,,,,,,,,,,,,,,,,,,,,,,,,,,,,,,,,
HPUAERNJ,journalArticle,2009,"Valle-Díaz, Oscar; Blanco-García, Arnulfo; Bonfil, Consuleo; Paz, Horacio; Lindig-Cisneros, Roberto",Altitudinal range shift detected through seedling survival of Ceiba aesculifolia in an area under the influence of an urban heat island,Forest Ecology and Management,,3781127,10.1016/j.foreco.2009.07.001,https://linkinghub.elsevier.com/retrieve/pii/S0378112709004770,,2009-09,8/14/2020 17:26,8/14/2020 17:26,8/14/2020 17:26,1511-1515,,7,258,,Forest Ecology and Management,,,,,,,,en,,,,,DOI.org (Crossref),,,1,,,,,,,,,,,,,,,,,,,,,,,,,,,,,,,,,,,,,,,,,,,,,,,,,,
UBP73WW5,journalArticle,2019,"Pecchi, Matteo; Marchi, Maurizio; Burton, Vanessa; Giannetti, Francesca; Moriondo, Marco; Bernetti, Iacopo; Bindi, Marco; Chirici, Gherardo",Species distribution modelling to support forest management. A literature review,Ecological Modelling,,3043800,10.1016/j.ecolmodel.2019.108817,https://linkinghub.elsevier.com/retrieve/pii/S0304380019303254,,2019-11,8/14/2020 17:26,8/14/2020 17:26,8/14/2020 17:26,108817,,,411,,Ecological Modelling,,,,,,,,en,,,,,DOI.org (Crossref),,,,,,,,,,,,,,,,,,,,,,,,,,,,,,,,,,,,,,,,,,,,,,,,,,,,,
QD85ITKY,journalArticle,2017,"Matisons, Roberts; Puriņa, Līga; Adamovičs, Andis; Robalte, Linda; Jansons, Āris",European beech in its northeasternmost stands in Europe: Varying climate-growth relationships among generations and diameter classes,Dendrochronologia,,11257865,10.1016/j.dendro.2017.08.004,https://linkinghub.elsevier.com/retrieve/pii/S1125786517300590,,2017-10,8/14/2020 17:26,8/14/2020 17:26,8/14/2020 17:26,123-131,,,45,,Dendrochronologia,European beech in its northeasternmost stands in Europe,,,,,,,en,,,,,DOI.org (Crossref),,,,,,,,,,,,,,,,,,,,,,,,,,,,,,,,,,,,,,,,,,,,,,,,,,,,,
ZGNG7S55,journalArticle,2013,"Day, J. Kenneth; Pérez, David Manuel",Reducing uncertainty and risk through forest management planning in British Columbia,Forest Ecology and Management,,3781127,10.1016/j.foreco.2012.11.035,https://linkinghub.elsevier.com/retrieve/pii/S0378112712007116,,2013-07,8/14/2020 17:27,8/18/2020 3:38,8/14/2020 17:27,117-124,,,300,,Forest Ecology and Management,,,,,,,,en,,,,,DOI.org (Crossref),,,1,,,,,,,,,,,,,,,,,,,,,,,,,,,,,,,,,,,,,,,,,,,,,,,,,,
FVGJH7WP,journalArticle,2018,"Vilà-Cabrera, Albert; Coll, Lluís; Martínez-Vilalta, Jordi; Retana, Javier",Forest management for adaptation to climate change in the Mediterranean basin: A synthesis of evidence,Forest Ecology and Management,,3781127,10.1016/j.foreco.2017.10.021,https://linkinghub.elsevier.com/retrieve/pii/S0378112717313300,,2018-01,8/14/2020 17:27,8/14/2020 17:27,8/14/2020 17:27,16-22,,,407,,Forest Ecology and Management,Forest management for adaptation to climate change in the Mediterranean basin,,,,,,,en,,,,,DOI.org (Crossref),,,1,C:\Users\trase\Zotero\storage\VBFZSURL\Vilà-Cabrera et al. - 2018 - Forest management for adaptation to climate change.pdf,,,,,,,,,,,,,,,,,,,,,,,,,,,,,,,,,,,,,,,,,,,,,,,,,
2ARNX9UZ,journalArticle,2015,"Yang, Jing; Pedlar, John H.; McKenney, Daniel W.; Weersink, Alfons","The development of universal response functions to facilitate climate-smart regeneration of black spruce and white pine in Ontario, Canada",Forest Ecology and Management,,3781127,10.1016/j.foreco.2014.12.001,https://linkinghub.elsevier.com/retrieve/pii/S0378112714007087,,2015-03,8/14/2020 17:27,8/14/2020 17:27,8/14/2020 17:27,34-43,,,339,,Forest Ecology and Management,,,,,,,,en,,,,,DOI.org (Crossref),,,,,,,,,,,,,,,,,,,,,,,,,,,,,,,,,,,,,,,,,,,,,,,,,,,,,
