Key,Item Type,Publication Year,Author,Title,Publication Title,ISBN,ISSN,DOI,Url,Abstract Note,Date,Date Added,Date Modified,Access Date,Pages,Num Pages,Issue,Volume,Number Of Volumes,Journal Abbreviation,Short Title,Series,Series Number,Series Text,Series Title,Publisher,Place,Language,Rights,Type,Archive,Archive Location,Library Catalog,Call Number,Extra,Notes,File Attachments,Link Attachments,Manual Tags,Automatic Tags,Editor,Series Editor,Translator,Contributor,Attorney Agent,Book Author,Cast Member,Commenter,Composer,Cosponsor,Counsel,Interviewer,Producer,Recipient,Reviewed Author,Scriptwriter,Words By,Guest,Number,Edition,Running Time,Scale,Medium,Artwork Size,Filing Date,Application Number,Assignee,Issuing Authority,Country,Meeting Name,Conference Name,Court,References,Reporter,Legal Status,Priority Numbers,Programming Language,Version,System,Code,Code Number,Section,Session,Committee,History,Legislative Body
3PEKRXQ9,journalArticle,2019,"Baldwin, Bruce G.","Fine-scale to Flora-wide Phylogenetic Perspectives on Californian Plant Diversity, Endemism, and Conservation",Annals of the Missouri Botanical Garden,,"2162-4372, 0026-6493",10.3417/2019423,https://annals.mobot.org/index.php/annals/article/view/423,"The California Floristic Province (CA-FP) encompasses North America’s Mediterranean-type climatic region and is a global biodiversity hotspot in temperate North America. Fine-scale phylogenetic studies and increasing scrutiny of morphological, ecological, and geographic variation in the CA-FP vascular flora continue to reveal novel, often cryptic diversity warranting taxonomic attention. The prevalence of such discoveries warrants caution about potential for loss of undescribed or unrecognized biodiversity from human-related impacts, including insufficiently informed conservation-related actions (e.g., genetic augmentation or assisted migration). Broader-scale molecular phylogenetic studies have yielded other examples of more extensive CA-FP diversification than previously resolved. For example, clades uniting CA-FP taxa not earlier thought to be such close relatives have been discovered in a wide diversity of tribes of composites and legumes. This understanding adds additional weight to the conclusions of Raven and Axelrod (1978) that in situ evolution, especially since the pronounced mid-Miocene transition toward summer-drying, has been a major factor in the origins of Californian vascular plant diversity. The importance of paleo-endemism in gymnosperms and (especially woody) angiosperms of the CA-FP flora also has been corroborated and refined by molecular phylogenetic studies, with improved understanding of the timing of divergence and relationships of isolated lineages, such as the extinct island-endemic Hesperelaea A. Gray (Oleaceae). On a regional scale, studies of spatial patterns of Californian species richness, phylogenetic diversity, and phylogenetic endemism by the California Plant Phylodiversity Project (CPPP) have reinforced the floristic importance of areas of high topographic complexity, or environmental heterogeneity more generally, where relatively high levels of habitat diversity, speciation, and lineage persistence may be expected. The CPPP’s finding that particularly young plant lineages and significantly high phylogenetic endemism are concentrated in drier regions of the CA-FP and in the adjacent Californian deserts has corroborated earlier preliminary findings and aligns with Stebbins’s (1952) hypothesis of aridity as an evolutionary stimulus. A recent conservation gap analysis by the CPPP incorporating flora-wide phylogenetic and geographic occurrence data plus land-protection status and habitat-integrity information for California has demonstrated the potential of an integrative, evolutionary approach for identifying high-priority land conservation targets.",8/28/2019,8/14/2020 18:28,8/14/2020 18:28,8/14/2020 18:28,429-440,,3,104,,annals,,,,,,,,,,,,,DOI.org (Crossref),,,1,C:\Users\trase\Zotero\storage\7Z462JBV\Baldwin - 2019 - Fine-scale to Flora-wide Phylogenetic Perspectives.pdf,,,,,,,,,,,,,,,,,,,,,,,,,,,,,,,,,,,,,,,,,,,,,,,,,
LU3LF3YF,journalArticle,2014,"Tepedino, Vincent J.; Mull, John; Griswold, Terry L.; Bryant, Gerald",Reproduction and Pollination of the Endangered Dwarf Bear-Poppy <i>Arctomecon humilis</i> (Papaveraceae) across a Quarter Century: Unraveling of a Pollination Web?,Western North American Naturalist,,"1527-0904, 1944-8341",10.3398/064.074.0306,http://www.bioone.org/doi/abs/10.3398/064.074.0306,,2014-11,8/14/2020 18:28,8/14/2020 18:28,8/14/2020 18:28,311-324,,3,74,,Western North American Naturalist,Reproduction and Pollination of the Endangered Dwarf Bear-Poppy <i>Arctomecon humilis</i> (Papaveraceae) across a Quarter Century,,,,,,,en,,,,,DOI.org (Crossref),,,1,C:\Users\trase\Zotero\storage\TLDVFYA7\Tepedino et al. - 2014 - Reproduction and Pollination of the Endangered Dwa.pdf,,,,,,,,,,,,,,,,,,,,,,,,,,,,,,,,,,,,,,,,,,,,,,,,,
SZN7GYQ4,journalArticle,2016,"Périé, Catherine; de Blois, Sylvie",Dominant forest tree species are potentially vulnerable to climate change over large portions of their range even at high latitudes,PeerJ,,2167-8359,10.7717/peerj.2218,https://peerj.com/articles/2218,"Projecting suitable conditions for a species as a function of future climate provides a reasonable, although admittedly imperfect, spatially explicit estimate of species vulnerability associated with climate change. Projections emphasizing range shifts at continental scale, however, can mask contrasting patterns at local or regional scale where management and policy decisions are made. Moreover, models usually show potential for areas to become climatically unsuitable, remain suitable, or become suitable for a particular species with climate change, but each of these outcomes raises markedly different ecological and management issues. Managing forest decline at sites where climatic stress is projected to increase is likely to be the most immediate challenge resulting from climate change. Here we assess habitat suitability with climate change for five dominant tree species of eastern North American forests, focusing on areas of greatest vulnerability (loss of suitability in the baseline range) in Quebec (Canada) rather than opportunities (increase in suitability). Results show that these species are at risk of maladaptation over a remarkably large proportion of their baseline range. Depending on species, 5–21% of currently climatically suitable habitats are projected to be at risk of becoming unsuitable. This suggests that species that have traditionally defined whole regional vegetation assemblages could become less adapted to these regions, with significant impact on ecosystems and forest economy. In spite of their well-recognised limitations and the uncertainty that remains, regionally-explicit risk assessment approaches remain one of the best options to convey that message and the need for climate policies and forest management adaptation strategies.",7/13/2016,8/14/2020 18:33,8/14/2020 18:33,8/14/2020 18:33,e2218,,,4,,,,,,,,,,en,,,,,DOI.org (Crossref),,,1,C:\Users\trase\Zotero\storage\3IPA6W56\Périé and de Blois - 2016 - Dominant forest tree species are potentially vulne.pdf,,,,,,,,,,,,,,,,,,,,,,,,,,,,,,,,,,,,,,,,,,,,,,,,,
T6XYHM7H,journalArticle,2017,"Janowiak, Maria K.; Iverson, Louis R.; Fosgitt, Jon; Handler, Stephen D.; Dallman, Matt; Thomasma, Scott; Hutnik, Brad; Swanston, Christopher W.",Assessing Stand-Level Climate Change Risk Using Forest Inventory Data and Species Distribution Models,Journal of Forestry,,0022-1201,10.5849/jof.2016-023R1,https://academic.oup.com/jof/article/115/3/222-229/4599824,,5/23/2017,8/14/2020 18:32,8/18/2020 3:38,8/14/2020 18:32,222-229,,3,115,,Journal of Forestry,,,,,,,,en,,,,,DOI.org (Crossref),,,1,C:\Users\trase\Zotero\storage\ZZDEBNF7\Janowiak et al. - 2017 - Assessing Stand-Level Climate Change Risk Using Fo.pdf,,,,,,,,,,,,,,,,,,,,,,,,,,,,,,,,,,,,,,,,,,,,,,,,,
MF29D8IK,journalArticle,2016,"Marchi, Maurizio; Nocentini, Susanna; Ducci, Fulvio",Future scenarios and conservation strategies for a rear-edge marginal population of Pinus nigra Arnold in Italian central Apennines,Forest Systems,,2171-9845,10.5424/fs/2016253-09476,http://revistas.inia.es/index.php/fs/article/view/9476,"Aim of study: To forecast the effects of climate change on the spatial distribution of Black pine of Villetta Barrea in its natural range and to define a possible conservation strategy for the speciesArea of study: A rear-edge marginal population of Pinus nigra spp. nigra in Abruzzo region, central Italian ApenninesMatherials and Methods: For its adaptive and genetic traits this population is considered endemic of the Italian peninsula and represents a rear-edge marginal population of nigra subspecies. The spatial distribution of the tree in the administrative Region (Abruzzo) was used to define the ecological traits while three modelling techniques (GLM, GAM, Random Forest) were used to build a Species distribution model according to two climatic scenarios.Main results: The marginal population's range was predicted to shift at higher elevations as consequence of climatic adaptation. Many zones, represented by the higher part of the mountains surrounding the study area (currently bare and inhospitable for trees), were identified as suitable in future for the species. However, in the case of a rapid climate change, this marginal population may not be able to move as fast as necessary. An in-situ adaptive management integrated with an assisted migration protocol might be considered to enforce the natural regeneration and improve the richness and variability of the genetic pool.Research highlights: Most of the genetic richness is held in small populations at the borders of natural distribution of forest species. Monitoring this MAP could be useful to understand the adaptive processes of the species and could support the future management of many other within-core populations.Keywords: Species Distribution Models; Mediterranean forests; Abruzzo; climate change; altitudinal shift.",12/2/2016,8/14/2020 18:32,8/14/2020 18:32,8/14/2020 18:32,e072,,3,25,,Forest Syst,,,,,,,,,,,,,DOI.org (Crossref),,,,C:\Users\trase\Zotero\storage\8CHVYYTC\Marchi et al. - 2016 - Future scenarios and conservation strategies for a.pdf,,,,,,,,,,,,,,,,,,,,,,,,,,,,,,,,,,,,,,,,,,,,,,,,,
C42J73X7,journalArticle,2017,"Gray, Laura K.; Clarke, Charles; Wint, G. R. William; Moran, Jonathan A.",Potential effects of climate change on members of the Palaeotropical pitcher plant family Nepenthaceae,PLOS ONE,,1932-6203,10.1371/journal.pone.0183132,https://dx.plos.org/10.1371/journal.pone.0183132,,8/17/2017,8/19/2020 1:22,8/19/2020 1:23,8/19/2020 1:22,e0183132,,8,12,,PLoS ONE,,,,,,,,en,,,,,DOI.org (Crossref),,4,1,C:\Users\trase\Zotero\storage\CIYPWWAM\Gray et al. - 2017 - Potential effects of climate change on members of .pdf,,,,"Kumar, Lalit",,,,,,,,,,,,,,,,,,,,,,,,,,,,,,,,,,,,,,,,,,,,,
GIRIV4L2,journalArticle,2015,"Gömöry, Dušan; Longauer, Roman; Krajmerová, Diana",Voľba lesného reprodukčného materiálu v podmienkach klimatickej zmeny / Choice of forest reproductive material under conditions of climate change,Forestry Journal,,0323-1046,10.1515/forj-2015-0021,https://www.degruyter.com/doi/10.1515/forj-2015-0021,"Abstract             Climate change may endanger not only yield and fulfilling the social functions of European forests, but even the survival of several tree species. The study emphasises the complexity of climatic factors and physiological mechanisms, which may potentially endanger the persistence of tree populations and which cannot be reduced to problems of drought and temperature increase. A substantial inter-population variation in traits associated with the response to climatic stress, observed in provenance experiments, is a prerequisite for the choice of proper forest reproductive material (FRM) in reforestation as a strategy of climate-change mitigation. Assisted migration, i.e., transfer of FRM from source regions, currently characterised by such climate characteristics, which are expected in the target regions in the future, requires knowledge of key stress factors (depending on the climate scenario), physiological processes associated with the adaptation to this stress, identification of genes and eventually epigenetic mechanisms, controlling adaptation processes, and finally mapping of genetic and/or epigenetic variation in key genes. For most tree species, such information is not yet available. Therefore, assisted migration under such information uncertainty needs to be complemented by in situ gene conservation measures to preserve the possibility of reversing the effects of eventual erroneous decisions on FRM transfer.",6/1/2015,8/19/2020 1:22,8/19/2020 1:24,8/19/2020 1:22,124-130,,2,61,,,,,,,,,,,,,,,DOI.org (Crossref),,4,1,C:\Users\trase\Zotero\storage\I4M25RHE\Gömöry et al. - 2015 - Voľba lesného reprodukčného materiálu v podmienkac.pdf,,,,,,,,,,,,,,,,,,,,,,,,,,,,,,,,,,,,,,,,,,,,,,,,,
8WEDA5TC,journalArticle,2012,"Garbelotto, Matteo; Pautasso, Marco",Impacts of exotic forest pathogens on Mediterranean ecosystems: four case studies,European Journal of Plant Pathology,,"0929-1873, 1573-8469",10.1007/s10658-011-9928-6,http://link.springer.com/10.1007/s10658-011-9928-6,,2012-05,8/19/2020 1:22,8/19/2020 1:25,8/19/2020 1:22,101-116,,1,133,,Eur J Plant Pathol,Impacts of exotic forest pathogens on Mediterranean ecosystems,,,,,,,en,,,,,DOI.org (Crossref),,35,1,,,,,,,,,,,,,,,,,,,,,,,,,,,,,,,,,,,,,,,,,,,,,,,,,,
M6SF86BQ,journalArticle,2019,"García-Hernández, María de los Ángeles; Toledo-Aceves, Tarin; López-Barrera, Fabiola; Sosa, Vinicio J.; Paz, Horacio",Effects of environmental filters on early establishment of cloud forest trees along elevation gradients: Implications for assisted migration,Forest Ecology and Management,,3781127,10.1016/j.foreco.2018.09.042,https://linkinghub.elsevier.com/retrieve/pii/S0378112718315238,,2019-01,8/19/2020 1:21,8/19/2020 1:25,8/19/2020 1:21,427-435,,,432,,Forest Ecology and Management,Effects of environmental filters on early establishment of cloud forest trees along elevation gradients,,,,,,,en,,,,,DOI.org (Crossref),,,1,,,,,,,,,,,,,,,,,,,,,,,,,,,,,,,,,,,,,,,,,,,,,,,,,,
B64T88L8,journalArticle,2019,"Caughlin, T. Trevor; Damschen, Ellen I.; Haddad, Nick M.; Levey, Douglas J.; Warneke, Christopher; Brudvig, Lars A.",Landscape heterogeneity is key to forecasting outcomes of plant reintroduction,Ecological Applications,,"1051-0761, 1939-5582",10.1002/eap.1850,https://onlinelibrary.wiley.com/doi/abs/10.1002/eap.1850,,2019-03,8/19/2020 1:21,8/19/2020 1:25,8/19/2020 1:21,,,2,29,,Ecol Appl,,,,,,,,en,,,,,DOI.org (Crossref),,1,1,,,,,,,,,,,,,,,,,,,,,,,,,,,,,,,,,,,,,,,,,,,,,,,,,,
MINBHPKH,journalArticle,2018,"Brooker, Rob W.; Brewer, Mark J.; Britton, Andrea J.; Eastwood, Antonia; Ellis, Christopher; Gimona, Alessandro; Poggio, Laura; Genney, David R.",Tiny niches and translocations: The challenge of identifying suitable recipient sites for small and immobile species,Journal of Applied Ecology,,218901,10.1111/1365-2664.13008,http://doi.wiley.com/10.1111/1365-2664.13008,,2018-03,8/19/2020 1:21,8/19/2020 1:25,8/19/2020 1:21,621-630,,2,55,,J Appl Ecol,Tiny niches and translocations,,,,,,,en,,,,,DOI.org (Crossref),,5,,,,,,"de Frenne, Pieter",,,,,,,,,,,,,,,,,,,,,,,,,,,,,,,,,,,,,,,,,,,,,
DPQZCZR4,journalArticle,2013,"Gray, Laura K.; Hamann, Andreas",Tracking suitable habitat for tree populations under climate change in western North America,Climatic Change,,"0165-0009, 1573-1480",10.1007/s10584-012-0548-8,http://link.springer.com/10.1007/s10584-012-0548-8,,2013-03,8/19/2020 1:22,8/19/2020 1:26,8/19/2020 1:22,289-303,,2-Jan,117,,Climatic Change,,,,,,,,en,,,,,DOI.org (Crossref),,127,,,,,,,,,,,,,,,,,,,,,,,,,,,,,,,,,,,,,,,,,,,,,,,,,,,
4X7N5X4E,journalArticle,2011,"Gray, Laura K.; Hamann, Andreas","Strategies for Reforestation under Uncertain Future Climates: Guidelines for Alberta, Canada",PLoS ONE,,1932-6203,10.1371/journal.pone.0022977,https://dx.plos.org/10.1371/journal.pone.0022977,,8/10/2011,8/19/2020 1:23,8/19/2020 1:26,8/19/2020 1:23,e22977,,8,6,,PLoS ONE,Strategies for Reforestation under Uncertain Future Climates,,,,,,,en,,,,,DOI.org (Crossref),,74,,C:\Users\trase\Zotero\storage\9WZUT9ZB\Gray and Hamann - 2011 - Strategies for Reforestation under Uncertain Futur.pdf,,,,"Kim, Soo-Hyung",,,,,,,,,,,,,,,,,,,,,,,,,,,,,,,,,,,,,,,,,,,,,
TQSTKHIB,journalArticle,2013,"Grewell, Brenda J.; Espeland, Erin K.; Fiedler, Peggy L.",Sea change under climate change: case studies in rare plant conservation from the dynamic San Francisco Estuary,Botany,,"1916-2790, 1916-2804",10.1139/cjb-2012-0300,http://www.nrcresearchpress.com/doi/10.1139/cjb-2012-0300,"We present case studies supporting management of two rare plant species in tidal wetlands of the San Francisco Estuary. We used empirical demographic analyses to identify factors to enhance population establishment and survival of Chloropyron molle subsp. molle (Orobancaceae), an annual hemiparasite, and to compare reintroduced with natural populations. Twelve years after outplanting, the reintroduced population persists but is in decline; impediments to success include the lack of adaptive management response to weed invasions and muted variance in hydrology. Transplantation of Lilaeopsis masonii (Apiaceae), a rhizomatous perennial herb, failed to meet success criteria for mitigation at local project scale, but dispersal and establishment of metapopulation patches indicated persistence at the landscape scale. This species has been found to be genetically indistinct from a widespread congener, and has few threats to persistence so long as suitable habitat is present. These two examples demonstrate the need for integrated conservation management strategies that prioritize habitat connectivity and maintain physical processes to support dispersal in response to sea level rise. For the hemiparasite, assisted colonization may sustain populations threatened by sea level rise, but only if a strong commitment to effective stewardship is realized.",2013-05,8/19/2020 1:23,8/19/2020 1:26,8/19/2020 1:23,309-318,,5,91,,Botany,Sea change under climate change,,,,,,,en,,,,,DOI.org (Crossref),,4,,,,,,,,,,,,,,,,,,,,,,,,,,,,,,,,,,,,,,,,,,,,,,,,,,,
SUFQTZ2C,journalArticle,2018,"Guerin, G. R.; O’Connor, P. J.; Sparrow, B.; Lowe, A. J.",An ecological climate change classification for South Australia,Transactions of the Royal Society of South Australia,,"0372-1426, 2204-0293",10.1080/03721426.2018.1438803,https://www.tandfonline.com/doi/full/10.1080/03721426.2018.1438803,,1/2/2018,8/19/2020 1:23,8/19/2020 1:26,8/19/2020 1:23,70-85,,1,142,,Transactions of the Royal Society of South Australia,,,,,,,,en,,,,,DOI.org (Crossref),,5,1,,,,,,,,,,,,,,,,,,,,,,,,,,,,,,,,,,,,,,,,,,,,,,,,,,
CIPIXYCK,journalArticle,2020,"Hamilton, Jill; Flint, Shelby; Lindstrom, Jessica; Volk, Kate; Shaw, Ruth; Ahlering, Marissa",Evolutionary approaches to seed sourcing for grassland restorations,New Phytologist,,"0028-646X, 1469-8137",10.1111/nph.16427,https://onlinelibrary.wiley.com/doi/abs/10.1111/nph.16427,,2020-03,8/19/2020 1:23,8/19/2020 1:25,8/19/2020 1:23,2246-2248,,6,225,,New Phytol,,,,,,,,en,,,,,DOI.org (Crossref),,1,1,C:\Users\trase\Zotero\storage\HDVNXT4R\Hamilton et al. - 2020 - Evolutionary approaches to seed sourcing for grass.pdf,,,,,,,,,,,,,,,,,,,,,,,,,,,,,,,,,,,,,,,,,,,,,,,,,
V6BSPYJS,journalArticle,2015,"Hanberry, Brice B.; Hansen, Mark H.",Advancement of tree species across ecotonal borders into non-forested ecosystems,Acta Oecologica,,1146609X,10.1016/j.actao.2015.07.002,https://linkinghub.elsevier.com/retrieve/pii/S1146609X15300059,,2015-10,8/19/2020 1:23,8/19/2020 1:25,8/19/2020 1:23,24-36,,,68,,Acta Oecologica,,,,,,,,en,,,,,DOI.org (Crossref),,6,1,,,,,,,,,,,,,,,,,,,,,,,,,,,,,,,,,,,,,,,,,,,,,,,,,,
3R648BZR,journalArticle,2015,"Hanberry, Brice B.; Hansen, Mark H.",Latitudinal range shifts of tree species in the United States across multi-decadal time scales,Basic and Applied Ecology,,14391791,10.1016/j.baae.2015.02.002,https://linkinghub.elsevier.com/retrieve/pii/S1439179115000213,,2015-05,8/19/2020 1:23,8/19/2020 1:25,8/19/2020 1:23,231-238,,3,16,,Basic and Applied Ecology,,,,,,,,en,,,,,DOI.org (Crossref),,13,1,,,,,,,,,,,,,,,,,,,,,,,,,,,,,,,,,,,,,,,,,,,,,,,,,,
T7EV5SVY,journalArticle,2014,"Hancock, Nola; Gallagher, Rachael",How ready are we to move species threatened from climate change? Insights into the assisted colonization debate from Australia: Insights into the Assisted Colonization Debate,Austral Ecology,,14429985,10.1111/aec.12151,http://doi.wiley.com/10.1111/aec.12151,,2014-11,8/19/2020 1:23,8/19/2020 1:25,8/19/2020 1:23,830-838,,7,39,,Austral Ecology,How ready are we to move species threatened from climate change?,,,,,,,en,,,,,DOI.org (Crossref),,18,1,,,,,,,,,,,,,,,,,,,,,,,,,,,,,,,,,,,,,,,,,,,,,,,,,,
PPEDJB66,journalArticle,2019,"Kaye, Thomas N.; Bahm, Matt A.; Thorpe, Andrea S.; Gray, Erin C.; Pfingsten, Ian; Waddell, Chelsea","Population extinctions driven by climate change, population size, and time since observation may make rare species databases inaccurate",PLOS ONE,,1932-6203,10.1371/journal.pone.0210378,https://dx.plos.org/10.1371/journal.pone.0210378,,10/17/2019,8/19/2020 1:25,8/19/2020 1:25,8/19/2020 1:25,e0210378,,10,14,,PLoS ONE,,,,,,,,en,,,,,DOI.org (Crossref),,,1,"C:\Users\trase\Zotero\storage\TTP6VW4N\Kaye et al. - 2019 - Population extinctions driven by climate change, p.pdf",,,,"Rozylowicz, Laurentiu",,,,,,,,,,,,,,,,,,,,,,,,,,,,,,,,,,,,,,,,,,,,,
WV2SLAIA,journalArticle,2017,"Hof, Anouschka R.; Dymond, Caren C.; Mladenoff, David J.",Climate change mitigation through adaptation: the effectiveness of forest diversification by novel tree planting regimes,Ecosphere,,21508925,10.1002/ecs2.1981,http://doi.wiley.com/10.1002/ecs2.1981,,2017-11,8/19/2020 1:24,8/19/2020 1:25,8/19/2020 1:24,e01981,,11,8,,Ecosphere,Climate change mitigation through adaptation,,,,,,,en,,,,,DOI.org (Crossref),,26,1,C:\Users\trase\Zotero\storage\BNQQFZIM\Hof et al. - 2017 - Climate change mitigation through adaptation the .pdf,,,,,,,,,,,,,,,,,,,,,,,,,,,,,,,,,,,,,,,,,,,,,,,,,
Y4MR8TCT,journalArticle,2015,"Hultine, Kevin R.; Bean, Dan W.; Dudley, Tom L.; Gehring, Catherine A.",Species Introductions and Their Cascading Impacts on Biotic Interactions in desert riparian ecosystems,Integrative and Comparative Biology,,"1540-7063, 1557-7023",10.1093/icb/icv019,https://academic.oup.com/icb/article-lookup/doi/10.1093/icb/icv019,,2015-10,8/19/2020 1:24,8/19/2020 1:25,8/19/2020 1:24,587-601,,4,55,,Integr. Comp. Biol.,,,,,,,,en,,,,,DOI.org (Crossref),,11,,C:\Users\trase\Zotero\storage\WJIBCXLK\Hultine et al. - 2015 - Species Introductions and Their Cascading Impacts .pdf,,,,,,,,,,,,,,,,,,,,,,,,,,,,,,,,,,,,,,,,,,,,,,,,,
SC5NGTT8,journalArticle,2018,"Izuddin, Muhammad; Yam, Tim Wing; Webb, Edward L.",Specific niche requirements drive long-term survival and growth of translocated epiphytic orchids in an urbanised tropical landscape,Urban Ecosystems,,"1083-8155, 1573-1642",10.1007/s11252-018-0733-2,http://link.springer.com/10.1007/s11252-018-0733-2,,2018-06,8/19/2020 1:25,8/19/2020 1:25,8/19/2020 1:25,531-540,,3,21,,Urban Ecosyst,,,,,,,,en,,,,,DOI.org (Crossref),,3,,,,,,,,,,,,,,,,,,,,,,,,,,,,,,,,,,,,,,,,,,,,,,,,,,,
TJUDGHCH,journalArticle,2014,"Liu, Jun-Jun; Chan, Danelle; Sturrock, Rona; Sniezko, Richard A.",Genetic variation and population differentiation of the endochitinase gene family in Pinus monticola,Plant Systematics and Evolution,,"0378-2697, 1615-6110",10.1007/s00606-013-0963-y,http://link.springer.com/10.1007/s00606-013-0963-y,,2014-06,8/19/2020 1:40,8/19/2020 1:40,8/19/2020 1:40,1313-1322,,6,300,,Plant Syst Evol,,,,,,,,en,,,,,DOI.org (Crossref),,,1,,,,,,,,,,,,,,,,,,,,,,,,,,,,,,,,,,,,,,,,,,,,,,,,,,
BHV3AARK,journalArticle,2015,"Liu, Hong; Ren, Hai; Liu, Qiang; Wen, XiangYing; Maunder, Michael; Gao, JiangYun",Translocation of threatened plants as a conservation measure in China: Plant Translocations in China,Conservation Biology,,8888892,10.1111/cobi.12585,http://doi.wiley.com/10.1111/cobi.12585,,2015-12,8/19/2020 1:40,8/19/2020 1:40,8/19/2020 1:40,1537-1551,,6,29,,Conservation Biology,Translocation of threatened plants as a conservation measure in China,,,,,,,en,,,,,DOI.org (Crossref),,,,,,,,,,,,,,,,,,,,,,,,,,,,,,,,,,,,,,,,,,,,,,,,,,,,,
FFWNTNKC,journalArticle,2015,"Leverkus, Alexandro B.; Castro, Jorge; Delgado-Capel, Manuel J.; Molinas-González, Carlos; Pulgar, Manuel; Marañón-Jiménez, Sara; Delgado-Huertas, Antonio; Querejeta, José I.",Restoring for the present or restoring for the future: enhanced performance of two sympatric oaks ( <i>Quercus ilex</i> and <i>Quercus pyrenaica</i> ) above the current forest limit: Enhanced oak performance above altitude limits,Restoration Ecology,,10612971,10.1111/rec.12259,http://doi.wiley.com/10.1111/rec.12259,,2015-11,8/19/2020 1:40,8/19/2020 1:40,8/19/2020 1:40,936-946,,6,23,,Restor Ecol,Restoring for the present or restoring for the future,,,,,,,en,,,,,DOI.org (Crossref),,,1,,,,,,,,,,,,,,,,,,,,,,,,,,,,,,,,,,,,,,,,,,,,,,,,,,
ZRWJU2UH,journalArticle,2010,"Ledig, F. Thomas; Rehfeldt, Gerald E.; Sáenz-Romero, Cuauhtémoc; Flores-López, Celestino",Projections of suitable habitat for rare species under global warming scenarios,American Journal of Botany,,29122,10.3732/ajb.0900329,http://doi.wiley.com/10.3732/ajb.0900329,,2010-06,8/19/2020 1:40,8/19/2020 1:40,8/19/2020 1:40,970-987,,6,97,,American Journal of Botany,,,,,,,,en,,,,,DOI.org (Crossref),,,1,,,,,,,,,,,,,,,,,,,,,,,,,,,,,,,,,,,,,,,,,,,,,,,,,,
